"Project #","Project Title","Research Focus Area","Research Program","Administering IC(s)",Institution(s),Investigator(s),Location(s),"Year Awarded",Summary
3U19AR076725-01S1,"HEALing LB3P: Profiling Biomechanical, Biological and Behavioral phenotypes","Clinical Research in Pain Management","Back Pain Consortium Research Program",NIAMS,"UNIVERSITY OF PITTSBURGH AT PITTSBURGH","SOWA, GWENDOLYN A","Pittsburgh, PA",2020,"Multiple factors, including inflammation contribute to chronic low back pain. Inflammation is mediated by numerous genes. The study aims to determine how variations in the genes encoding key inflammatory mediators impact the response of patients with chronic low back pain to physical therapy treatment. Gene variations that are known to be linked to inflammation and pain will be tested against their possible association on physical therapy treatment outcomes, to inform clinical decisions on optimal care. This study will support training in clinical research on pain within the context of the HEAL BACPAC Mechanistic Research Center. It will provide resources for a research project relevant to the parent grant and the career development of an individual in the field of pain research. The ability to identify a set of genetic variations and classify patients according to treatment response might enable use of DNA testing as a screening tool for targeted treatments for patients with CLBP."
3U19MH113135-04S1,"Social Connectedness and Behavioral Health Risks Among AI/AN Urban Adults","New Strategies to Prevent and Treat Opioid Addiction","Preventing Opioid Use Disorder",NIMH,"UNIVERSITY OF COLORADO DENVER","MANSON, SPERO MARTIN","Aurora, CO",2020,"American Indian and Alaska Native (AI/AN) youth and young adults experience disproportionately high rates of suicide, mental health disorders, traumatic life events, and substance use disorder. More effective, culturally informed interventions are needed that are tailored to the specific needs of this population. This supplement will examine how a person?s social network contributes to their behavioral health (suicide risk, mental health, substance use) status and how this network can be leveraged to improve the uptake of prevention interventions. The long-term goal is to disseminate and translate the lessons learned into practical policy, organizational changes, and preventive innovations that optimize patient-centered health outcomes and ultimately reduce or eliminate the dramatic and tragic suicide-related health disparities among urban AI/AN YYAs."
3UH3DA050174-02S1,"Revision to the HOME Trial: Suicide Treatment Education and Prevention (HOME + STEP)","New Strategies to Prevent and Treat Opioid Addiction","Optimizing Care for People with Opioid Use Disorder and Mental Health Conditions",NIDA,"OHIO STATE UNIVERSITY","SLESNICK, NATASHA ; KELLEHER, KELLY J","Columbus, OH",2020,"Homeless youth have high rates of alcohol and drug use, comorbid mental health conditions, and are at high risk for suicide. However, few preventive interventions have been proven for reducing substance use or addressing suicide among homeless youth. Resolution of youth homelessness through housing and prevention services, often referred to as ?Housing First? (HF), will be tested in the HOME (Housing, Opportunities, Motivation and Engagement) study, which aims to reduce opioid use and progression to opioid use disorder (OUD). This study will include suicide screening, treatment, education and prevention (STEP) to the model to examine whether HF provides secondary benefits for reducing suicidal ideation and behaviors among high risk homeless youth. STEP includes ongoing suicide screening procedures and Cognitive Therapy for Suicide Prevention (CTSP) for those at high risk for suicide. Youth (N=240) will be randomly assigned to receive HF + STEP + opioid and related risk prevention services (strengths-based outreach and advocacy; HIV Prevention; and motivational Interviewing) or to receive STEP + opioid and related risk prevention services, alone. Results from this study will inform the design and implementation of other national models of HF to address prevention of substance use and suicidal ideation and behaviors among homeless youth."
1UG3DA051392-01,"Evaluation of the Safety and Efficacy of a New Oral Small Molecule GABA-B Receptor Positive Allosteric Modulator (PAM) as an Add-on Maintenance Therapy for Opioid Use Disorder (OUD)","Novel Medication Options for Opioid Use Disorder and Overdose",,NIDA,"ASTELLAS PHARMA GLOBAL DEVELOPMENT, INC.","Blahunka, Paul","NORTHBROOK, IL",2020,"no summary"
1R01NS117340-01,"B Lymphocyte-Mediated Autoimmunity in Pain After Trauma","Preclinical and Translational Research in Pain Management","Discovery and Validation of Novel Targets for Safe and Effective Treatment of Pain",NINDS,"PALO ALTO VETERANS INSTIT FOR RESEARCH","CLARK, DAVID J","Palo Alto, CA",2020,"A major recent advancement for the field of pain research is the recognition of immune system dysregulation as a contributor to the most serious adverse consequences of pain from injury. Accumulating data from clinical and laboratory studies place the activation of B lymphocytes at the center of much of this work, particularly with respect to chronic pain and disability-related outcomes. Validation of this B cell hypothesis could lead directly to trials testing the efficacy of novel or existing immunomodulating agents on posttraumatic pain. To achieve these goals a well-validated core mouse model of limb fracture will be employed with additional studies to be conducted in incisional and nerve injury models to broaden the assessment of B cell mediated effects on pain. Age and sex will be included as variables to enhance rigor."
1R01NS116694-01,"Validation of Spinal Neurotensin Receptor 2 as an Analgesic Target","Preclinical and Translational Research in Pain Management","Discovery and Validation of Novel Targets for Safe and Effective Treatment of Pain",NINDS,"UNIVERSITY OF ARIZONA","PATWARDHAN, AMOL M","Tuscon, AZ",2020,"Epidural/spinal administration of analgesics such as opioids, ziconotide and local anesthetics have profound efficacy in some of the most intractable pain conditions such as severe neuropathic pain after failed back surgery, cancer pain and post-operative pain after major abdominal/thoracic surgeries. Contulakin G (CGX) is a snail venom derived peptide that has homology with mammalian neurotensin and was shown to be safe in humans in preliminary studies. A small pilot study demonstrated CGX?s analgesic effect in some patients with spinal cord injury-associated pain. Preliminary findings from mechanistic studies in rodents identified neurotensin receptor 2 (NTSR2) as the mediator for analgesic effects of CGX. This project aims to validate spinal NTSR2 as an analgesic target utilizing three species (rat, mice and human), and two pain models (neuropathic pain and post-surgical pain). The project will utilize pharmacological and gene editing tools such as CRISPR-Cas9 and will include assessment of both sensory and affective measures of pain. A two-site parallel confirmation study is designed based on multisite clinical trials to further authenticate spinal NTSR2 as an analgesic target. Successful completion of this project could lead to the development of a non-opioid spinal analgesic that has high translational potential."
1UG3CA261067-01,"Optimizing the Use of Ketamine to Reduce Chronic Postsurgical Pain","Clinical Research in Pain Management","Pain Management Effectiveness Research Network",NINDS,"NEW YORK UNIVERSITY SCHOOL OF MEDICINE","WANG, JING; DOAN, LISA","New York, NY",2020,"Approximately 20% of patients who undergo surgery develop chronic pain, or Chronic Postsurgical Pain (CPSP). CPSP is highly associated with impaired functional recovery and persistent opioid use and dependence, and current standard postoperative multimodal analgesia is only moderately effective for its prevention. This study aims to determine whether the use of ketamine during and/or after surgery prevents Post-Mastectomy Pain Syndrome (PMPS), one of the most common CPSP conditions. Ketamine is a low-risk treatment option that is easy to implement in a wide range of clinical settings.  If successful, this treatment could improve postoperative pain management in individuals undergoing mastectomy and help combat the opioid epidemic."
,"Development of Vaccines for the Treatment of Opioid Use Disorder","Novel Medication Options for Opioid Use Disorder and Overdose",,NIAID,"Boston Children's Hospital","Ofer Levy","Boston, MA",2020,"High rates of relapse and overdose deaths pose significant challenges to the treatment of Opioid Use Disorder (OUD).  Anti-opioid immunotherapies (i.e., vaccines and monoclonal antibodies) have great potential to reduce long-term opioid use and overdose, with minimal risk of side effects, when used in conjunction with pharmacological treatments and/or behavioral therapies. The ability of an anti-opioid vaccine to induce antibodies that render an opioid less effective, or less rewarding, and protect from accidental overdose could provide an important therapeutic option for patients undergoing treatment for OUD.  The goal of this collaborative study is to design, develop, and evaluate vaccines for use in the treatment of opioid use disorder"
3UG3TR003149-02S1,"Supplement to hiPSC-based DRG Tissue Mimics on Multi-well Microelectrode Arrays as a Tissue Chip Model of Acute and Chronic Nociception","Preclinical and Translational Research in Pain Management","Discovery and Validation of Novel Targets for Safe and Effective Treatment of Pain",NCATS,"UNIVERSITY OF TEXAS DALLAS","BLACK, BRYAN JAMES","Dallas, TX",2020,"This study aims to determine whether a subset of understudied genes that are expressed in human and mouse dorsal root ganglia (DRG) tissues (critical for relaying the sensation of pain from the body to the central nervous system), are also expressed in human induced pluripotent stem cell DRG mimetics. The study will also determine if these genes are involved in neuronal excitability changes under inflammatory conditions and compare these responses to those of primary DRG neurons. Third and finally, the study will optimize genetic depletion of target genes enabling future fundamental and preclinical research studies."
3R01NS111929-01A1S1,"Anatomic, Physiologic and Transcriptomic Mechanisms of Neuropathic Pain in Human DRG","Preclinical and Translational Research in Pain Management","Discovery and Validation of Novel Targets for Safe and Effective Treatment of Pain",NINDS,"UNIVERSITY OF TX MD ANDERSON CAN CTR","DOUGHERTY, PATRICK M","Houston, TX",2020,"Using neural tissues from pain patients, this project will investigate mechanisms of neuronal and/or immune dysfunction driving chronic pain. The researchers will use spatial transcriptomics on human dorsal root ganglion (DRG) and spinal cord tissues to examine the cellular expression profile for these targets using the 10X Genomics Visium technology. The use of tissues from control surgical patients and organ donors as well as surgical patients with neuropathic pain will enable validation of expression of these targets in human tissue as well as indication of their potential involvement in neuropathic pain. This collaborative effort will use DRGs removed from pain-phenotyped patients during neurological surgery, as well as lumbar DRGs and spinal cord from organ donors. This study will map the spatial transcriptomes at approximately single cell resolution in the human DRG and spinal cord."
3U01DK123812-01S1,"Creating a multi-level intervention to reduce stigma for buprenorphine use for individuals with End Stage Kidney Disease and Chronic Pain","Clinical Research in Pain Management","Integrated Approach to Pain and Opioid Use in Hemodialysis Patients",NIDDK,"UNIVERSITY OF PITTSBURGH AT PITTSBURGH","JHAMB, MANISHA","Pittsburgh, PA",2020,"Medications have proven to be effective for treating opioid use disorder (OUD). Increasing accessibility to buprenorphine provides an opportunity for many with OUD to benefit from its proven effectiveness.  Adherence to medication-based treatments however is low, in part because of the stigma associated with use of this and other effective drugs and as such, leads to inadequate treatment and poor outcomes. This study aims to understand the effects of stigma on patient engagement, retention, and outcomes of buprenorphine treatment.  Knowledge drawn from the HIV Stigma Theory and tools developed to reduce HIV associated stigma will be used to assess OUD stigma and to develop interventions to reduce it in the context of buprenorphine treatment. The study findings may provide resources to address stigma and thus maximize treatment adherence among those affected by OUD."
3U24NS113849-01S1,"The Icahn School of Medicine at Mount Sinai (ISMMS) EPPIC-Net Specialized Clinical Center","Clinical Research in Pain Management","Early Phase Pain Investigation Clinical Network (EPPIC-Net)",NINDS,"ICAHN SCHOOL OF MEDICINE AT MOUNT SINAI","ROBINSON-PAPP, JESSICA","New York, NY",2020,"Exacerbation of health disparities has emerged during the COVID 19 pandemic and highlighted the recognition that minority underrepresentation in clinical research may contribute to racial disparities in health outcomes. In clinical trials related to pain, disparities in trial patient inclusion are documented by white patients often being overrepresented. Mitigating these disparities is an area in which an early-career pain investigator training and contributions may have lasting benefits. The pandemic also drove rapid expansion of telehealth for pain management without knowledge of how social and demographic factors affect utilization patterns of this care delivery model.  This supplement supports research to examine the extent to which disparities exist in access to and outcomes of telehealth in socially marginalized pain patients. Findings will be applied to enrich  the diversity in clinical trial populations for phase 2 safety trials performed in the HEAL EPPIC Network."
3UG1DA050072-02S2,"Transitions Clinic Network:  Post Incarceration Addiction Treatment, Healthcare, and Social Support (TCN PATHS) study","New Strategies to Prevent and Treat Opioid Addiction","Sleep Dysfunction as a Core Feature of Opioid Use Disorder and Recovery",NIDA,"YALE UNIVERSITY","Wang, Emily Ai-hua","New Haven, CT",2020,"All forms of sleep deficiency can affect OUD treatment engagement and retention among  people with OUD, particularly among people recently released from jail. Sleep deficiency may lead to a wide range of physical and psychological perturbations that may increase the likelihood of illicit opioid use, and disengagement in OUD treatment. This study will examine the association between sleep deficiency and OUD treatment retention in a sample of people receiving medications for OUD who were recently released from jail, to reduce morbidity and mortality from OUD among justice-involved individuals. The underlying rationale for this study is that sleep deficiency must be addressed in a holistic manner to support OUD treatment engagement. The specific aims are to 1) determine the prevalence of sleep deficiency and describe the sleep environment of a sample of people on MOUD recently released from jail; 2) estimate the association between sleep deficiency and OUD treatment retention; and 3) examine sleep environment as a potential mediator of sleep deficiency and OUD treatment retention in people recently released from jail. If successful, this study will provide data for the future development and testing of patient-centered interventions focusing on sleep deficiency among OUD treatment participants that enhance their retention in treatment"
3R01MH112148-03S1,"Improving the Identification and Management of Suicide Risk among Patients Using Prescription Opioids","New Strategies to Prevent and Treat Opioid Addiction","Optimizing Care for People with Opioid Use Disorder and Mental Health Conditions",NIMH,"UNIVERSITY OF CONNECTICUT SCH OF MED/DNT","ASELTINE, ROBERT H","Farmington, CT",2020,"The project will address gaps in both risk identification and clinical management by utilizing comprehensive clinical data from a mature health information exchange containing more than 2.3 million patients across the spectrum of clinical care (hospitals, primary care, specialty care, community health centers, urgent care) to develop a statistically robust method to measure suicide risk associated with prescription opioid use. First, the team will couple data fusion techniques with machine learning-based approaches in identifying the clinical and demographic characteristics associated with elevated risk of suicidal behavior among prescription opioid users. Second, the team will develop clinical profiles of patients with higher risk of suicidal behavior associated with prescription opioids, and to incorporate these profiles in a clinical decision support platform that can be used for identification and intervention at the point of care. The clinical decision support tool developed under this proposal will provide a generalizable platform that could be extended to other more conventional opioid related outcomes such as OUD and overdose."
R01NS120663-01A1,"Genetic and Pharmacological Validation of CRMP2 Phosphorylation as a Novel therapeutic Target for Neuropathic Pain","Preclinical and Translational Research in Pain Management","Discovery and Validation of Novel Targets for Safe and Effective Treatment of Pain",NINDS,"UNIVERSITY OF ARIZONA","KHANNA, RAJESH","Tucson, AZ",2020,"Peripheral nerve injury-induced upregulation of three axonal guidance phosphoproteins correlates with the development of neuropathic pain through an unidentified mechanism: 1) collapsin response mediator protein 2 (CRMP2); 2) the N-type voltage-gated calcium (CaV2.2); 3) the NaV1.7 voltage-gated sodium channel. Injury induced phosphorylated-CRMP2/CaV2.2 and phosphorylated-CRMP2/NaV1.7 upregulation in the sensory pathway may promote abnormal excitatory synaptic transmission in spinal cord that leads to neuropathic pain states. This project will validate CRMP2 phosphorylation as a novel target in neuropathic pain using innovative tools. Examples include a genetic approach (crmp2S522A) in mice as well as a non-opioid pharmacological approach (a novel CRMP2-phsphorylation targeting compound). Demonstrating that inhibition of CRMP2 phosphorylation reverses or prevents neuropathic pain will promote the discovery and validation of a novel therapeutic target (CRMP2-phosphorylation) to facilitate the development of novel pain therapeutics."
1R01DE029074-01A1,"Novel Target Identification for Treatment of Chronic Overlapping Pain Using Multimodal Brain Imaging","Preclinical and Translational Research in Pain Management","Discovery and Validation of Novel Targets for Safe and Effective Treatment of Pain",NINDS,"UNIVERSITY OF MARYLAND BALTIMORE","TRAUB, RICHARD J; MELEMEDJIAN, OHANNES KEVORK","Baltimore, MD",2020,"As many as 64% of patients with Temporomandibular Joint Disorders (TMJDs) report symptoms consistent with Irritable Bowel Syndrome (IBS). However the underlying connection between these comorbid conditions is unclear and treatment options are poor. As such, pain management for these Chronic Overlapping Pain Conditions (COPCs) is a challenge for physicians and patients. This project will determine whether the convergence of pain from different peripheral tissues and perceived stress occurs in the brain and elicits a change in central neural processing of painful stimuli. This project will identify and validate specific lipids, enzymes and metabolic pathways that change expression in the brain during the transition from acute to chronic overlapping pain that can be therapeutically targeted to treat COPCs. Multi-disciplinary approaches will be used to combine brain imaging, visualization of spatial distribution of molecules, genetics, pharmacological and behavioral research techniques."
1UG3AT011265-01,"Hybrid Effectiveness-Implementation Trial of Guided Relaxation and Acupuncture for Chronic Sickle Cell Disease Pain","Clinical Research in Pain Management","Pragmatic and Implementation Studies for the Management of Pain to Reduce Opioid Prescribing (PRISM)",NCCIH,"UNIVERSITY OF ILLINOIS AT CHICAGO","DOORENBOS, ARDITH Z; EZENWA, MIRIAM OMELEBELE; MOLOKIE, ROBERT E; SCHLAEGER, JUDITH MICHELLE; SHAH, NIRMISH R","Chicago, IL",2020,"In the US, approximately 100,000 people, mainly of African and Hispanic background have Sickle Cell Disease (SCD). Pain is a constant companion and chronic disabling symptom for those with SCD. It is increasingly clear that adults with chronic SCD pain also experience periods of acute worsening of their pain. The evaluation of nonpharmacological therapies that reduce chronic pain and the need for opioid medication among individuals with SCD is critically needed to address lack of adequate pain control to prevent periods of acute deterioration and high opioid use with negative sequelae. The investigators will conduct a hybrid type 1 effectiveness-implementation trial to assess the effectiveness of acupuncture and guided relaxation in patients with SCD while observing and gathering information on implementation in three health systems. The study will utilize a 3-arm, 3-site pragmatic randomized controlled SMART trial design that evaluates adaptive interventions, in which selection of interventions responds to patients? characteristics and evolving clinical status. The investigators will use the Consolidated Framework for Implementation Research to plan, execute, and evaluate implementation processes."
1R61HL156240-01,"Treatment of Fentanyl Overdose-Induced Respiratory Failure by Low-Dose Dexmedetomidine","Novel Medication Options for Opioid Use Disorder and Overdose",,NHLBI,"PENNSYLVANIA STATE UNIV HERSHEY MED CTR","HAOUZI, PHILIPPE A","Hershey, PA",2020,"no summary"
3R37DA020686-13S1,"Role for Tas2Rs in opioid addiction","Preclinical and Translational Research in Pain Management","Discovery and Validation of Novel Targets for Safe and Effective Treatment of Pain",NIDA,"ICAHN SCHOOL OF MEDICINE AT MOUNT SINAI","KENNY, PAUL J.","New York, NY",2020,"Opioids and other addictive substances have powerful rewarding properties that drive the development of addiction. They also have aversive properties that motivate their avoidance and protect against addiction. This project will explore the role of Type 2 Taste Receptor proteins (Tas2Rs or T2Rs) in regulating the aversive properties of opioids, potentially establishing an entirely new class of receptors that can be targeted for the development of novel addiction therapeutics."
"3 U44 NS115111-01","High-Resolution, Spinal Cord Stimulation for Non-Opioid Treatment of Neuropathic Pain","Preclinical and Translational Research in Pain Management","Small Business Research and Development",NINDS,"MICRO-LEADS, INC.","MCLAUGHLIN, BRYAN L","Somerville, MA",2020,"This project aims to develop and clinically validate a 64-channel spinal cord stimulation therapy for treating chronic neuropathic pain of the lower extremities, groin, and lower back. With an increased channel count and the ability to precisely target medial and lateral structures of the spinal cord, the system will treat chronic pain with greater efficacy and reduced side effects. This project will pursue a safe, effective, and non-addictive treatment for neuropathic pain through the testing of enhanced HD64 active leads to be manufactured under GMP regulations. The leads will then undergo electrical, mechanical, biocompatibility, and sterilization testing before being tested in a 10-subject early feasibility study."
3UH3AR076568-02S1,"Examining the effect of intersectional stigma on the treatment of negative affect in chronic low back pain","Clinical Research in Pain Management","Back Pain Consortium Research Program",NIAMS,"UNIVERSITY OF PITTSBURGH AT PITTSBURGH","WASAN, AJAY D","Pittsburgh, PA",2020,"Patients with chronic low back pain, often have depressive and anxiety symptoms and use opioids all of which are associated with stigma. In turn stigma leads to decreased treatment seeking and adherence, increased depression and pain, and poor treatment outcomes. Intersection of these health-related stigmas may have synergistic effects.  This study aims to enhance the findings of a clinical trial to test antidepressant medication and Enhanced Fear Avoidance Rehabilitation in patients with chronic low back pain and high levels of depression and anxiety. The effects of these intersecting types of stigma on the efficacy of the interventions will be evaluated to better understand the needs of the patient population and to inform development of a stigma reducing intervention that can be implemented care providers."
3R37DA047926-02S1,"Social networks of young American Indian adolescents and their parents:Characteristics, connections, and response to intervention","New Strategies to Prevent and Treat Opioid Addiction","Preventing Opioid Use Disorder",NIDA,"UNIVERSITY OF COLORADO DENVER","WHITESELL, NANCY RUMBAUGH","Aurora, CO",2020,"no summary"
