"Project #","Project Title","Research Focus Area","Research Program","Administering IC(s)",Institution(s),Investigator(s),Location(s),"Year Awarded",Summary
1UG3DA048387-01A1,"Methocinnamox (MCAM): A novel ?-opioid receptor antagonist for opioid use disorders","Novel Medication Options for Opioid Use Disorder and Overdose",,NIDA,"University of Texas Health Science Center San Antonio","Woods, James","San Antonio, TX",2019,"MCAM is a novel opioid antagonist that can be used for opioid overdose reversal and has advantages over naloxone, including a pseudo-irreversible interaction with the ?-opioid receptor and a longer duration of action. Studies in animal models demonstrate MCAM’s long duration of action against the reinforcing and respiratory-depressant effects of remifentanil and heroin, indicating that could be a better treatment option for opioid use disorder. This project studies the pharmacodynamics of MCAM through animal toxicity and safety studies to establish the necessary and sufficient conditions from which to establish MCAM’s safety and antagonist activity in animals and humans. MCAM may be able to prevent all actions of any ?-receptor opioid drug in humans for a longer period of time than any other antagonist given acutely."
2R44DA041912-03,"COMPLETION OF IND-PACKAGE FOR A NOVEL, NON-NARCOTIC PAINKILLER","New Strategies to Prevent and Treat Opioid Addiction","Small Business Research and Development",NIDA,"Blue Therapeutics, Inc.","Yekkirala, Ajay S","CAMBRIDGE,  MA",2019,"Opioids like morphine and hydrocodone are generally the most effective therapeutics for treatment of moderate to severe pain. However, their use is limited by serious side effects: tolerance, constipation, respiratory depression, physical dependence, and high addictive potential. Alternative pain relievers with the analgesic potency of conventional opioids, but devoid of narcotic side effects, are an immediate need. The goal of this project is to develop and commercialize an alternative to conventional opioid analgesics with reduced side effects and without the addictive properties common to mu-opioid agonists, targeting a new molecule in the central nervous system. This project will perform the necessary preliminary studies to prepare this new molecule for an investigational new drug application with the FDA."
2R44DA049640-02,"Virtual Reality as a Opioid Sparing Intervention for Acute Postoperative Pain Management","New Strategies to Prevent and Treat Opioid Addiction","Small Business Research and Development",NIDA,"APPLIEDVR, INC","AYAD, SABRY; KESHOCK, MAUREEN; POWERS, JOE; STEARNS, KIM; SUK, MICHAEL","Los Angeles, CA",2019,"Millions of Americans undergo surgery each year, with fewer than half of patients reporting adequate postoperative pain relief and approximately 75 percent reporting moderate to severe postoperative pain. Gaps in postoperative pain management that lead to the unnecessary introduction and over-prescription of opioids continue to exacerbate the opioid crisis, but virtual reality (VR) has been demonstrated to be an effective strategy for pain management. This project will enhance and improve the functionality of a VR-based technology, AppliedVR, to provide acute perioperative pain management through a new software-based VR medical device, RelieVRx™. As a non-opioid alternative intended to reduce postoperative pain, RelieVRx can potentially reduce the need for and utilization of opioids in the postoperative setting."
3UG1DA040316-05S2,"Clinic-Randomized Trial of Clinical Decision Support for Opioid Use Disorders in Medical Settings","Translation of Research to Practice for the Treatment of Opioid Addiction","Enhancing the National Drug Abuse Treatment Clinical Trials Network to Address Opioids",NIDA,"HENNEPIN HEALTHCARE RESEARCH INSTITUTE","BART, GAVIN; JOSEPH, ANNE","Minneapolis, MN",2019,"There is a significant treatment gap between patients diagnosed with OUD and those who seek treatment, and only a small proportion of those seeking treatment receive MOUD. Primary care is the most common point of health care contact in the U.S. and is an important venue to address stigma, improve access to treatment and improve quality of care. Over the past decade, electronic health record (EHR)-linked Web-based point-of-care clinical decision support (CDS) systems designed to improve quality of chronic disease care have become increasingly sophisticated and successful. A Web-based and EHR-integrated OUD CDS system to offer expert guidance to primary care providers (PCPs) on the diagnosis and management of OUD was developed and piloted. This project will implement the OUD clinical decision support system in three large diverse health care systems and randomize a minimum of 30 clinics to receive the OUD-CDS intervention or usual care (UC). The project will evaluate the impact of OUD CDS on practice process measures and patient outcomes. The study will also prepare for scalability and dissemination by evaluating facilitators and barriers to implementation, determining the costs of implementation and maintenance and assessing the short-term cost impacts of the OUD-CDS."
1UG3DA047709-01,"An ultra-long-acting oral treatment for opioid use disorder","Novel Medication Options for Opioid Use Disorder and Overdose",,NIDA,"LYNDRA THERAPEUTICS, INC.","BELLINGER, ANDREW MARTIN","Boston, MA",2019,"Buprenorphine (BUP) is an FDA-approved medication-assisted therapy (MAT) that improves outcomes and saves lives in patients with opioid use disorder (OUD). It is available in multiple dosage forms and routes of administration, including daily sublingual (SL) and buccal tablets and films, a monthly subcutaneous (SC) injectable, and a 6-month SC implant; however, these forms leave many patients untreated or undertreated. This product, in a partnership with Lyndra Therapeutics, aims to develop a once-weekly oral BUP dosage form for maintenance therapy for OUD, using a new oral dosage formulation developed by Lyndra. A long-acting oral BUP may address important limitations of current MATs by providing improved PK with less euphoria than SL, a patient- and provider-preferred route of administration, and an optimal dosing interval for improved patient adherence with the potential for cost-effective direct observed therapy."
3UG3DA047720-01S1,"Evaluation of safety and pharmacokinetics of naltrexone implant","Novel Medication Options for Opioid Use Disorder and Overdose",,NIDA,"NEW YORK STATE PSYCHIATRIC INSTITUTE","Bisaga, Adam","New York, NY",2019,"New medication treatment approaches are needed to help address the severe epidemic of opioid use disorder (OUD) and opioid overdose deaths in the U.S. Currently available medications, such as methadone, buprenorphine, and extended release injection naltrexone (XR-NTX; trade name: Vivitrol), are highly efficacious, but their effectiveness in practice is limited by poor adherence, with many patients stopping treatment prematurely and relapsing. The goal of this proposal is to develop an innovative long-acting subcutaneous implanted formulation of naltrexone, the O’Neil Long-Acting Naltrexone Implant (OLANI), toward FDA approval. Expected to produce naltrexone blood levels sufficient to block the effects of opioids for 6 months after implant, OLANI circumvents the need for adherence to monthly injections with XR-NTX and could represent an important new addition to the medical armamentarium for treatment of OUD."
1UH2AR076723-01,"Wearable nanocomposite sensor system for diagnosing mechanical sources of low back pain and guiding rehabilitation","Clinical Research in Pain Management","Back Pain Consortium Research Program",NIAMS,"BRIGHAM YOUNG UNIVERSITY","BOWDEN, ANTON E","Provo, UT",2019,"Chronic low back pain (cLBP) is recurrent and often nonresponsive to conservative treatments. Biomechanists, physical therapists, and surgeons each utilize a variety of tools and techniques to assess and interpret qualitative movement changes to understand potential mechanical and neurological sources of low back pain and as critical elements in their treatment paradigm. However, objectively characterizing and communicating this information is currently impossible, since clinically feasible (i.e., cost-effective, objective, and accurate) tools and quantitative benchmarks do not exist. This research addresses the challenge to improve cLBP outcomes through the use of unique, inexpensive, screen-printable, elastomer-based, nanocomposite, piezoresponsive sensors, which will be integrated into a SPInal Nanosensor Environment (SPINE) sense system to measure lumbar kinematics and provide an objective, quantitative platform for diagnosis, monitoring, and follow-up assessment of cLBP."
1UG3DA047925-01,"Development of a 3-month implantable depot pellet of Naltrexone for the treatment of Opioid Use Disorder.","Novel Medication Options for Opioid Use Disorder and Overdose",,NIDA,"BIOCORRX, INC.","BRAR, BALBIR","Anaheim, CA",2019,"The opioid antagonist naltrexone (NTX) is a proven treatment for opioid use disorder (OUD); however, lack of adherence is a serious limitation that has prevented NTX from reaching its maximum therapeutic potential. To address this limitation, BioCorRx is developing BICX102, a subcutaneous solid depot pellet of NTX, a single implantation of which can provide continual blockade of opioid receptors for up to 3 months. This can prevent patients from being adversely affected by almost any opioid relapse event, while improving efficacy and adherence to behavioral programs that support long-term management and recovery. This proposal comprises the steps required to achieve FDA approval. Successful development of BICX102 would result in a safe and effective 3-month subcutaneous depot pellet/implant containing NTX (1,000 mg) that would be far less reliant on patient compliance."
3UG1DA040314-05S3,"Primary Care Opioid Use Disorders Treatment Trial (PROUD) Economic Analysis Study","Translation of Research to Practice for the Treatment of Opioid Addiction","Enhancing the National Drug Abuse Treatment Clinical Trials Network to Address Opioids",NIDA,"KAISER FOUNDATION RESEARCH INSTITUTE","CAMPBELL, CYNTHIA I; BRADLEY, KATHARINE ANTHONY; WEISNER, CONSTANCE M.","Oakland, CA",2019,"Effective treatment for OUD has been shown to improve patient outcomes and reduce health care costs; however, evidence of this effect in primary care settings is severely limited. The health economic findings from this study will supplement the parent PROUD trial’s results regarding clinical effectiveness and implementation outcomes and provide critical contextual information for health systems and other health care stakeholders. The study will evaluate the economic viability of the PROUD collaborative care model for OUD—that is, from the perspective of the health care sector, to what extent do the downstream cost savings associated with improved patient outcomes offset the additional costs of the PROUD intervention? The specific aims are to (1) estimate the start-up and ongoing management costs of the PROUD intervention, (2) assess costs associated with health care utilization for patients who receive primary care treatment in PROUD and usual care clinics and have been identified with recognized OUDs before clinic randomization, and (3) estimate the economic value of the PROUD intervention, measured as net monetary benefit (NMB, incremental benefit minus incremental cost), from the health care sector perspective."
1R21DA049861-01,"Impact of SB 273 on West Virginia Patients, Providers and Overall Prescription Rates of Opioid Medications","New Strategies to Prevent and Treat Opioid Addiction","Preventing Opioid Use Disorder",NIDA,"West Virginia University","Cara Sedney; Treah Haggerty","Morgantown, WV",2019,"In 2018, new opiate prescribing limits (SB 273) were implemented across West Virginia to combat the opiate misuse epidemic. This study will utilize quantitative and qualitative measures to determine the effect of the recent opiate prescription laws in West Virginia, how a change in policy affects the opiate misuse epidemic, and how communities may apply this knowledge more broadly. The research team will: 1) collaborate with the West Virginia Board of Pharmacy to ascertain changes in opiate prescribing habits before and after the start of SB 273 using an interrupted time series methodology, and 2) achieve broad and deep understanding of how SB 273 has affected prescribing practices and experiences amongst primary care physicians, specialists (pan physicians, surgeons, emergency room physicians, etc.), and patients who currently or previously utilized opiate medications."
1R43DA46973-01,"Device to Measure Pain using Facial Expression Recognition with Patiene PAINReportitA Tablet","New Strategies to Prevent and Treat Opioid Addiction","Small Business Research and Development",NIDA,"ENSURING, LLC","CHEN, ZHANLI","Seattle, WA",2019,"Even though pain is a nearly universal experience, objective measurements of pain remain difficult. Given that responding to the opioid crisis will require both better ways to manage pain and better ways to detect drug-seeking behavior, finding approaches to objectively measure pain is crucial. The goal of this project is to develop a product that will objectively measure pain using computer vision and machine learning technologies together with tablet-based self-reported pain data from patients for research or clinical purposes. The product will be low cost, involving one or two cameras to record the video and a computer to analyze the video in almost-real time, and will involve software that can be portable to ordinary personal computers and tablets. The project will capture facial expressions related to genuine pain and integrate it with patients’ self-reported pain data, in order to refine the product and create an objective measure of pain intensity that can be used in clinical settings and test its accuracy. This new tool has the potential to help rectify the poor pain outcomes that still plague Americans with opioid addiction, cancer, and other health conditions in many health care settings."
3U10HD036801-21S1,"MFMU HEAL Initiative Opportunity: Opioid Prescription Protocols at Discharge after cesarean delivery","Clinical Research in Pain Management","Pain Management Effectiveness Research Network",NICHD,"George Washington University","Clifton, Rebecca","Washington, DC",2019,"Cesarean deliveries are the most commonly performed surgical procedure in the United States. Opioids are almost universally used for post-cesarean analgesia management. Studies suggest that most women are prescribed more tablets at discharge than needed. These often go unused, providing an important reservoir contributing to the opioid crisis. Physicians struggle to prescribe and dose postoperative opioids appropriately while tackling the real needs of acute pain from surgery. Without literature to guide obstetric providers on appropriate amounts of opioids to prescribe upon discharge, actual prescription amounts nationally vary widely by up to 65 tablets. To improve post-cesarean opioid prescribing practices without compromising pain management, the study will test an individualized, patient-empowered approach for pain management and opioid prescription quantity. This is a noninferiority randomized trial of 5,500 women with a cesarean delivery who will be randomized prior to discharge."
1R34DA050343-01,"3/6 Planning for the HEALthy Early Development Study","Enhanced Outcomes for Infants and Children Exposed to Opioids","HEALthy Brain and Child Development Study (HBCD)",NIDA,"OSU CENTER FOR HEALTH SCIENCES","CROFF, JULIE MAY; MORRIS, AMANDA S","Tulsa, OK",2019,"The Planning for the HEALthy Early Development Study will contribute to the design and recommended protocol for a future large-scale, multi-site research study to prospectively examine human brain, cognitive, behavioral, social, and emotional development of children beginning prenatally through ages 9–10 and to determine the impact of maternal pre- and postnatal substance use on short- and long-term development of children. The planning study will link investigators across 6 research sites who have complementary experience and expertise in the areas that are essential to designing the study. Planning activities will be accomplished using a coordinated set of 10 working groups. By the end of the planning phase, the 6 consortium sites will have produced and tested a recommended protocol for the future multi-site study and will have established feasibility of carrying out the study protocol at each of the 6 linked sites."
1R43DA046998-01,"DEVELOPMENT OF A MULTIPLEX PEPTIDE ARRAY TO IDENTIFY PATIENTS WITH AN AUTOANTIBODY SIGNATURE FOR CHRONIC PAIN","New Strategies to Prevent and Treat Opioid Addiction","Small Business Research and Development",NIDA,"Affinergy, LLC","Darby, Martyn","Durham, NC",2019,"One of the most widely used treatments for chronic pain is opioid analgesics. Importantly, there is evidence of a pathological interaction between opioids and the immune system that can contribute to both opioid tolerance and elevated levels of pain. Chronic pain conditions for which opioids are most often prescribed have been shown to involve dysregulation of the immune system, which may contribute to pathological effects of opioid use in these patients. To address this unmet need, this study aims to develop a reliable, cost-effective, and non-invasive in vitro diagnostic assay for chronic pain with an underlying inflammatory pathology, as a blood test available in primary care settings, with the hope that doctors can use the test to identify which patients might benefit less from opioids and be more likely to become addicted."
3U01DA036221-05S4,"TRIALS COORDINATING CENTER TO REDUCE SUBSTANCE USE, HIV RISK BEHAVIORS, &amp; CRIME","Translation of Research to Practice for the Treatment of Opioid Addiction","Justice Community Opioid Innovation Network",NIDA,"CHESTNUT HEALTH SYSTEMS, INC.","Dennis, Michael L","Bloomington, IL",2019,"Less than half of youth in the juvenile justice system who meet the criteria for substance use disorders (SUD) have ever received treatment, and less than one third of those received treatment while under community or correctional supervision. SUDs during adolescence can lead to significantly longer periods of substance use, more severe offending, and penetration in the justice system. The Translational Research on Interventions for Adolescents in the Legal System (TRIALS) cooperative is intended to develop and test implementation strategies and associated measures to improve the continuum of substance abuse and HIV prevention and treatment services delivered to youth under juvenile justice supervision."
1R44DA049685-01,"Noninvasive Brain Stimulation for Treating Addiction","New Strategies to Prevent and Treat Opioid Addiction","Small Business Research and Development",NIDA,"HIGHLAND INSTRUMENTS, INC","DIPIETRO, LAURA; WAGNER, TIMOTHY ANDREW","Cambridge, MA",2019,"Noninvasive brain stimulation (NIBS) may be effective in treating some forms of addiction, but the most common NIBS methods, Transcranial Magnetic Stimulation (TMS) and Transcranial Direct Current Stimulation (tDCS), have not been found to be effective in treating opioid use disorder (OUD). This project seeks to test the efficacy in OUD patients of Electrosonic Stimulation (ESStim™), an improved NIBS modality that combines independently controlled electromagnetic and ultrasonic fields to focus and boost stimulation currents via tuned electromechanical coupling in neural tissue."
1R43DA049650-01,"Patient-level Risk Identifier Models for a Multifactor Opioid Abuse Risk Assessment Strategy","New Strategies to Prevent and Treat Opioid Addiction","Small Business Research and Development",NIDA,"PRINCIPLED STRATEGIES, INC.","DuBose, Paul","ENCINITAS, CA",2019,"This project, a partnership with Principled Strategies, will develop innovative, patient-level models for opioid risk identification and integrate them into the SafeUseNow managed care system—an actionable solution for combating prescription drug abuse that currently operates at the prescriber level only. Incorporating patient-level risk identifier models will strengthen an already powerful and demonstrably effective program and constitutes a critical step in generating a first-in-class, multifactor risk assessment strategy that is truly holistic. Using a variety of data sources, advanced analytics, and multiple empirically validated risk identification models, the groundbreaking advancement in SafeUseNow technology will enable health care stakeholders to identify combinations of prescribers, patients, and pharmacies whose behaviors may contribute to prescription drug abuse. This project will work to obtain new datasets for analysis, assess them, and use them to build national patient-level risk models for relevant outcomes, which will enable the development and evaluation of a next-generation prototype for a patient-level version of SafeUseNow."
1U24NS115691-01,"UPENN HEAL - Pain Clinical Trial Network Specialized Clinical Center","Clinical Research in Pain Management","Early Phase Pain Investigation Clinical Network (EPPIC-Net)",NINDS,"UNIVERSITY OF PENNSYLVANIA","FARRAR, JOHN T; ASHBURN, MICHAEL ALAN","Philadelphia, PA",2019,"EPPIC-Net will provide a robust and readily accessible infrastructure for the rapid implementation and performance of high-quality comprehensive studies of patients with well-defined pain conditions, and the rapid design and performance of high-quality Phase 2 clinical trials to test promising novel therapeutics for pain. Using the Hospital of the University of Pennsylvania as a hub and five additional centers that are part of the UPenn Health System and the Children’s Hospital of Philadelphia (CHOP) as spokes, studies will be conducted as designed by the expertise of the EPPIC Network, which intends to bring intense focus to relatively small numbers of patients with clinically well-defined pain conditions and high unmet therapeutic needs. The UPenn Specialized Clinical Center (SCC) will test novel, efficient study designs including adaptive and platform designs, validation studies of biomarkers, and biomarker-informed proof of principle or target engagement studies in Phase 2 trials of interventions from academic and industry partners."
1R61AT010614-01,"The Youth Opioid Recovery Support (YORS) Intervention: An assertive community treatment model for improving medication adherence in young adults with opioid use disorder","Translation of Research to Practice for the Treatment of Opioid Addiction","Behavioral Research to Improve Medication-Based Treatment",NCCIH,"Maryland Treatment Centers","FISHMAN, MARC","Baltimore, MD",2019,"Young people are disproportionately affected by the opioid crisis due to lack of access to medications for opioid use disorder (OUD) and poor adherence to these treatments. The Youth Opioid Recovery Support (YORS) model is an innovative wraparound approach that attempts to address barriers to treatment engagement in the young adult population, especially difficulties with medication adherence. The YORS model components include home delivery of extended-release naltrexone for OUD, engagement of families in collaborative treatment planning and monitoring focusing on medication adherence, assertive outreach from the treatment team by text messaging and social media to promote engagement and adherence, and contingency management to provide incentives for medication adherence. If the refining and testing demonstrates the efficacy of the YORS intervention, future work could include an economic analysis, a larger multisite study, longer intervention duration, study of extended-release buprenorphine, and study of step-down to less intensive interventions."
1R34DA050255-01,"Planning Phase for the Healthy Brain and Child Development Study (HEALthy BCD) in Los Angeles County Area","Enhanced Outcomes for Infants and Children Exposed to Opioids","HEALthy Brain and Child Development Study (HBCD)",NIDA,"CEDARS-SINAI MEDICAL CENTER","GAO, WEI; GREGORY, KIMBERLY D; JOHNSON, SCOTT P; SIMMONS, CHARLES F","Los Angeles, CA",2019,"Prevalence rates of opioids misuse in Los Angeles County (LA) are particularly high among individuals of childbearing age and in already-vulnerable populations including African American females. These data highlight a pressing need for a systematic study of the effects of prenatal drug exposures (PDE) in the unique sociodemographic LA County area. In this project, researchers aim to establish the feasibility for the large-scale Phase II HEALthy BCD study in the Los Angeles area with three specific aims: (1) build a broad interdisciplinary team of investigators capable of a multi-faceted study of brain and behavioral development in both typically developing and at-risk infants/children; (2) establish a set of highly executable recruitment and retention strategies for both drug-free and drug-exposed infants/children; and (3)establish comprehensive study protocols that will help address the three key research objectives of the Phase II study."
